Vehicle_ID,Current_Location,Availability,Latitude,Longitude
V001,"PSG College Of Technology, Avinashi Rd, Peelamedu, Coimbatore, Tamil Nadu 641004",Available,11.0246833,77.0028425
V002," Gandhipuram, Tamil Nadu 641012",Available,11.0182714,76.9677744
V003,"The Oberoi, Bengaluru, 37-39, Mahatma Gandhi Rd, Yellappa Garden, Yellappa Chetty Layout, Sivanchetti Gardens, Bengaluru, Karnataka 560001",Available,12.9914,77.5944
V004,"D Mart - Kangeyam Road, Tiruppur, 41, Kangayam Rd, Venkateshwara Nagar, Bavani Nagar, Tiruppur, Tamil Nadu 641604",Available,27.42397,77.09922
V005,"Andhra University, Visakhapatnam, Andhra Pradesh 530003",Available,17.730362,83.3227609
