Warehouse_ID,Name,Address,Latitude,Longitude
W001,Chennai Central Hub,"No. 23, Anna Salai, Chennai, Tamil Nadu, 600002",13.0350576,80.2459951
W002,Bengaluru Distribution,"45/1, MG Road, Bengaluru, Karnataka, 560001",12.9759907,77.6046565
W003,Mysore Logistic Park,"Sayyaji Rao Road, Agrahara, Chamrajpura, Mysuru, Karnataka 570001",12.2979,76.6393
W004,Hyderabad Storage Unit,"Plot No. 56, HITEC City, Hyderabad, Telangana, 500081",17.4508058,78.3834535
W005,Coimbatore Main Depot,"89, Avinashi Road, Coimbatore, Tamil Nadu, 641018",11.009385,76.9804364
